{
  "$schema": "../../review-summary.schema.json",
  "schema_version": "1.0.0",
  "id": "kimi-k3-2026-08-11-mktctx-review-summary",
  "provenance": {
    "source_name": "Kimi",
    "source_model_version": "K3",
    "relayed_by": "James via Codex chat",
    "received_on": "2026-08-11",
    "source_label": "Feedback from Kimi K3",
    "review_target": "A reported 161-file MKTCTX/3 Continuum packet generated by mktxt 3.0.0 with graft; exact artifact not identified"
  },
  "reported_validation": {
    "parser_written_without_additional_explanation": false,
    "indexed_files": 161,
    "exact_files": 161,
    "alias_files": 0,
    "claims": [
      "The reviewer reported reading the packet's complete structural skeleton and computationally checking several claims before relying on them.",
      "The reviewer reported verifying that F3a07f1dfb645 equals the first 12 hexadecimal characters of sha256(\".continuum/release.yml\").",
      "The reviewer reported verifying that the packet ID derives from the manifest hash, chunk terminators correspond to file hashes, and ranges are 1-based and inclusive.",
      "The reviewer reported checking that two release.yml chunk byte counts, 1515 and 167, sum to the index byte count of 1682."
    ]
  },
  "positive_findings": [
    "The one-line guide lets a cold consumer infer the packet's address and citation grammar in band.",
    "The repeated source-as-data boundary makes trust posture a first-class wire-format concept.",
    "Coverage, omissions, and unavailable analysis are explicit, so absence is not silently presented as nonexistence or completeness.",
    "Path-derived file identity, content identity, packet identity, symbol addresses, and alias identity form a coherent addressing system.",
    "The reviewer found the sampled byte arithmetic, digest relationships, and range conventions internally consistent."
  ],
  "reviewer_characterization": [
    "A self-describing, deterministic-looking plain-text context packet for repository slices, intended for both models and tools.",
    "A path-addressed base of files with symbol-tree fibers and an independent content-identity mapping.",
    "A promising substrate for LLM context, evaluation corpora, review packets, audit snapshots, and agent-tool citation interchange."
  ],
  "reviewer_priority": "Make byte lengths normatively authoritative, specify encoding and canonical serialization, populate dependency edges, and then consider causal packet chains and attestations.",
  "verification_posture": {
    "independently_reproduced_in_this_intake": false,
    "available_evidence": [
      "The complete review text and its reported spot checks were relayed by the user.",
      "The repository contains the MKTCTX/3 renderer, byte-count-driven parser, collision-avoidant terminator selection, tests, and a nested-protocol adversarial fixture."
    ],
    "limitations": [
      "The reviewed packet, verification commands, and computed outputs were not supplied, so the reported 161-file checks cannot be independently reproduced from this intake alone.",
      "The exact-file count is recorded from the reviewer's statement that projection=exact was used throughout; the underlying index was not available to confirm aliases or other projections.",
      "Some critique premises differ from current repository behavior and are preserved as provenance while repository-grounded corrections are recorded in the corresponding proposal artifacts."
    ]
  }
}
